FIND 9 DEVICES
DEVICE ID 1d6b:0003 on Bus 004 Address 001 =================
 bLength                :   0x12 (18 bytes)
 bDescriptorType        :    0x1 Device
 bcdUSB                 :  0x310 USB 3.1
 bDeviceClass           :    0x9 Hub
 bDeviceSubClass        :    0x0
 bDeviceProtocol        :    0x3
 bMaxPacketSize0        :    0x9 (9 bytes)
 idVendor               : 0x1d6b
 idProduct              : 0x0003
 bcdDevice              :  0x515 Device 5.15
 iManufacturer          :    0x3 Error Accessing String
 iProduct               :    0x2 Error Accessing String
 iSerialNumber          :    0x1 Error Accessing String
 bNumConfigurations     :    0x1
  CONFIGURATION 1: 0 mA ====================================
   bLength              :    0x9 (9 bytes)
   bDescriptorType      :    0x2 Configuration
   wTotalLength         :   0x1f (31 bytes)
   bNumInterfaces       :    0x1
   bConfigurationValue  :    0x1
   iConfiguration       :    0x0
   bmAttributes         :   0xe0 Self Powered, Remote Wakeup
   bMaxPower            :    0x0 (0 mA)
    INTERFACE 0: Hub =======================================
     bLength            :    0x9 (9 bytes)
     bDescriptorType    :    0x4 Interface
     bInterfaceNumber   :    0x0
     bAlternateSetting  :    0x0
     bNumEndpoints      :    0x1
     bInterfaceClass    :    0x9 Hub
     bInterfaceSubClass :    0x0
     bInterfaceProtocol :    0x0
     iInterface         :    0x0
      ENDPOINT 0x81: Interrupt IN ==========================
       bLength          :    0x7 (7 bytes)
       bDescriptorType  :    0x5 Endpoint
       bEndpointAddress :   0x81 IN
       bmAttributes     :    0x3 Interrupt
       wMaxPacketSize   :    0x4 (4 bytes)
       bInterval        :    0xc
DEVICE ID 04f3:0c4d on Bus 003 Address 004 =================
 bLength                :   0x12 (18 bytes)
 bDescriptorType        :    0x1 Device
 bcdUSB                 :  0x200 USB 2.0
 bDeviceClass           :    0x0 Specified at interface
 bDeviceSubClass        :    0x0
 bDeviceProtocol        :    0x0
 bMaxPacketSize0        :   0x40 (64 bytes)
 idVendor               : 0x04f3
 idProduct              : 0x0c4d
 bcdDevice              :  0x182 Device 1.82
 iManufacturer          :    0x1 ELAN
 iProduct               :    0x2 ELAN:Fingerprint
 iSerialNumber          :    0x0
 bNumConfigurations     :    0x1
  CONFIGURATION 1: 100 mA ==================================
   bLength              :    0x9 (9 bytes)
   bDescriptorType      :    0x2 Configuration
   wTotalLength         :   0x3e (62 bytes)
   bNumInterfaces       :    0x1
   bConfigurationValue  :    0x1
   iConfiguration       :    0x0
   bmAttributes         :   0xa0 Bus Powered, Remote Wakeup
   bMaxPower            :   0x32 (100 mA)
    INTERFACE 0: Vendor Specific ===========================
     bLength            :    0x9 (9 bytes)
     bDescriptorType    :    0x4 Interface
     bInterfaceNumber   :    0x0
     bAlternateSetting  :    0x0
     bNumEndpoints      :    0x5
     bInterfaceClass    :   0xff Vendor Specific
     bInterfaceSubClass :    0x0
     bInterfaceProtocol :    0x0
     iInterface         :    0x0
      ENDPOINT 0x81: Bulk IN ===============================
       bLength          :    0x7 (7 bytes)
       bDescriptorType  :    0x5 Endpoint
       bEndpointAddress :   0x81 IN
       bmAttributes     :    0x2 Bulk
       wMaxPacketSize   :   0x40 (64 bytes)
       bInterval        :    0x1
      ENDPOINT 0x1: Bulk OUT ===============================
       bLength          :    0x7 (7 bytes)
       bDescriptorType  :    0x5 Endpoint
       bEndpointAddress :    0x1 OUT
       bmAttributes     :    0x2 Bulk
       wMaxPacketSize   :   0x40 (64 bytes)
       bInterval        :    0x1
      ENDPOINT 0x82: Bulk IN ===============================
       bLength          :    0x7 (7 bytes)
       bDescriptorType  :    0x5 Endpoint
       bEndpointAddress :   0x82 IN
       bmAttributes     :    0x2 Bulk
       wMaxPacketSize   :   0x40 (64 bytes)
       bInterval        :    0x1
      ENDPOINT 0x83: Bulk IN ===============================
       bLength          :    0x7 (7 bytes)
       bDescriptorType  :    0x5 Endpoint
       bEndpointAddress :   0x83 IN
       bmAttributes     :    0x2 Bulk
       wMaxPacketSize   :   0x40 (64 bytes)
       bInterval        :    0x1
      ENDPOINT 0x3: Bulk OUT ===============================
       bLength          :    0x7 (7 bytes)
       bDescriptorType  :    0x5 Endpoint
       bEndpointAddress :    0x3 OUT
       bmAttributes     :    0x2 Bulk
       wMaxPacketSize   :   0x40 (64 bytes)
       bInterval        :    0x1
DEVICE ID 04f2:b6ee on Bus 003 Address 003 =================
 bLength                :   0x12 (18 bytes)
 bDescriptorType        :    0x1 Device
 bcdUSB                 :  0x201 USB 2.01
 bDeviceClass           :   0xef Miscellaneous
 bDeviceSubClass        :    0x2
 bDeviceProtocol        :    0x1
 bMaxPacketSize0        :   0x40 (64 bytes)
 idVendor               : 0x04f2
 idProduct              : 0xb6ee
 bcdDevice              : 0x2721 Device 39.21
 iManufacturer          :    0x3 Error Accessing String
 iProduct               :    0x1 Error Accessing String
 iSerialNumber          :    0x2 Error Accessing String
 bNumConfigurations     :    0x1
  CONFIGURATION 1: 500 mA ==================================
   bLength              :    0x9 (9 bytes)
   bDescriptorType      :    0x2 Configuration
   wTotalLength         :  0x368 (872 bytes)
   bNumInterfaces       :    0x2
   bConfigurationValue  :    0x1
   iConfiguration       :    0x4 Error Accessing String
   bmAttributes         :   0x80 Bus Powered
   bMaxPower            :   0xfa (500 mA)
    INTERFACE 0: Video =====================================
     bLength            :    0x9 (9 bytes)
     bDescriptorType    :    0x4 Interface
     bInterfaceNumber   :    0x0
     bAlternateSetting  :    0x0
     bNumEndpoints      :    0x1
     bInterfaceClass    :    0xe Video
     bInterfaceSubClass :    0x1
     bInterfaceProtocol :    0x0
     iInterface         :    0x5 Error Accessing String
      ENDPOINT 0x83: Interrupt IN ==========================
       bLength          :    0x7 (7 bytes)
       bDescriptorType  :    0x5 Endpoint
       bEndpointAddress :   0x83 IN
       bmAttributes     :    0x3 Interrupt
       wMaxPacketSize   :   0x10 (16 bytes)
       bInterval        :    0x6
    INTERFACE 1: Video =====================================
     bLength            :    0x9 (9 bytes)
     bDescriptorType    :    0x4 Interface
     bInterfaceNumber   :    0x1
     bAlternateSetting  :    0x0
     bNumEndpoints      :    0x0
     bInterfaceClass    :    0xe Video
     bInterfaceSubClass :    0x2
     bInterfaceProtocol :    0x0
     iInterface         :    0x0
    INTERFACE 1, 1: Video ==================================
     bLength            :    0x9 (9 bytes)
     bDescriptorType    :    0x4 Interface
     bInterfaceNumber   :    0x1
     bAlternateSetting  :    0x1
     bNumEndpoints      :    0x1
     bInterfaceClass    :    0xe Video
     bInterfaceSubClass :    0x2
     bInterfaceProtocol :    0x0
     iInterface         :    0x0
      ENDPOINT 0x81: Isochronous IN ========================
       bLength          :    0x7 (7 bytes)
       bDescriptorType  :    0x5 Endpoint
       bEndpointAddress :   0x81 IN
       bmAttributes     :    0x5 Isochronous
       wMaxPacketSize   :   0x80 (128 bytes)
       bInterval        :    0x1
    INTERFACE 1, 2: Video ==================================
     bLength            :    0x9 (9 bytes)
     bDescriptorType    :    0x4 Interface
     bInterfaceNumber   :    0x1
     bAlternateSetting  :    0x2
     bNumEndpoints      :    0x1
     bInterfaceClass    :    0xe Video
     bInterfaceSubClass :    0x2
     bInterfaceProtocol :    0x0
     iInterface         :    0x0
      ENDPOINT 0x81: Isochronous IN ========================
       bLength          :    0x7 (7 bytes)
       bDescriptorType  :    0x5 Endpoint
       bEndpointAddress :   0x81 IN
       bmAttributes     :    0x5 Isochronous
       wMaxPacketSize   :  0x200 (512 bytes)
       bInterval        :    0x1
    INTERFACE 1, 3: Video ==================================
     bLength            :    0x9 (9 bytes)
     bDescriptorType    :    0x4 Interface
     bInterfaceNumber   :    0x1
     bAlternateSetting  :    0x3
     bNumEndpoints      :    0x1
     bInterfaceClass    :    0xe Video
     bInterfaceSubClass :    0x2
     bInterfaceProtocol :    0x0
     iInterface         :    0x0
      ENDPOINT 0x81: Isochronous IN ========================
       bLength          :    0x7 (7 bytes)
       bDescriptorType  :    0x5 Endpoint
       bEndpointAddress :   0x81 IN
       bmAttributes     :    0x5 Isochronous
       wMaxPacketSize   :  0x400 (1024 bytes)
       bInterval        :    0x1
    INTERFACE 1, 4: Video ==================================
     bLength            :    0x9 (9 bytes)
     bDescriptorType    :    0x4 Interface
     bInterfaceNumber   :    0x1
     bAlternateSetting  :    0x4
     bNumEndpoints      :    0x1
     bInterfaceClass    :    0xe Video
     bInterfaceSubClass :    0x2
     bInterfaceProtocol :    0x0
     iInterface         :    0x0
      ENDPOINT 0x81: Isochronous IN ========================
       bLength          :    0x7 (7 bytes)
       bDescriptorType  :    0x5 Endpoint
       bEndpointAddress :   0x81 IN
       bmAttributes     :    0x5 Isochronous
       wMaxPacketSize   :  0xb00 (2816 bytes)
       bInterval        :    0x1
    INTERFACE 1, 5: Video ==================================
     bLength            :    0x9 (9 bytes)
     bDescriptorType    :    0x4 Interface
     bInterfaceNumber   :    0x1
     bAlternateSetting  :    0x5
     bNumEndpoints      :    0x1
     bInterfaceClass    :    0xe Video
     bInterfaceSubClass :    0x2
     bInterfaceProtocol :    0x0
     iInterface         :    0x0
      ENDPOINT 0x81: Isochronous IN ========================
       bLength          :    0x7 (7 bytes)
       bDescriptorType  :    0x5 Endpoint
       bEndpointAddress :   0x81 IN
       bmAttributes     :    0x5 Isochronous
       wMaxPacketSize   :  0xc00 (3072 bytes)
       bInterval        :    0x1
    INTERFACE 1, 6: Video ==================================
     bLength            :    0x9 (9 bytes)
     bDescriptorType    :    0x4 Interface
     bInterfaceNumber   :    0x1
     bAlternateSetting  :    0x6
     bNumEndpoints      :    0x1
     bInterfaceClass    :    0xe Video
     bInterfaceSubClass :    0x2
     bInterfaceProtocol :    0x0
     iInterface         :    0x0
      ENDPOINT 0x81: Isochronous IN ========================
       bLength          :    0x7 (7 bytes)
       bDescriptorType  :    0x5 Endpoint
       bEndpointAddress :   0x81 IN
       bmAttributes     :    0x5 Isochronous
       wMaxPacketSize   : 0x1380 (4992 bytes)
       bInterval        :    0x1
    INTERFACE 1, 7: Video ==================================
     bLength            :    0x9 (9 bytes)
     bDescriptorType    :    0x4 Interface
     bInterfaceNumber   :    0x1
     bAlternateSetting  :    0x7
     bNumEndpoints      :    0x1
     bInterfaceClass    :    0xe Video
     bInterfaceSubClass :    0x2
     bInterfaceProtocol :    0x0
     iInterface         :    0x0
      ENDPOINT 0x81: Isochronous IN ========================
       bLength          :    0x7 (7 bytes)
       bDescriptorType  :    0x5 Endpoint
       bEndpointAddress :   0x81 IN
       bmAttributes     :    0x5 Isochronous
       wMaxPacketSize   : 0x13fc (5116 bytes)
       bInterval        :    0x1
DEVICE ID 0d00:0721 on Bus 003 Address 007 =================
 bLength                :   0x12 (18 bytes)
 bDescriptorType        :    0x1 Device
 bcdUSB                 :  0x200 USB 2.0
 bDeviceClass           :    0x0 Specified at interface
 bDeviceSubClass        :    0x0
 bDeviceProtocol        :    0x0
 bMaxPacketSize0        :   0x40 (64 bytes)
 idVendor               : 0x0d00
 idProduct              : 0x0721
 bcdDevice              :  0x100 Device 1.0
 iManufacturer          :    0x1 GigaDevice
 iProduct               :    0x2 GD32-USB_Keyboard
 iSerialNumber          :    0x3 7D7E84EC0130
 bNumConfigurations     :    0x1
  CONFIGURATION 1: 100 mA ==================================
   bLength              :    0x9 (9 bytes)
   bDescriptorType      :    0x2 Configuration
   wTotalLength         :   0xbf (191 bytes)
   bNumInterfaces       :    0x5
   bConfigurationValue  :    0x1
   iConfiguration       :    0x0
   bmAttributes         :   0xa0 Bus Powered, Remote Wakeup
   bMaxPower            :   0x32 (100 mA)
    INTERFACE 2: Human Interface Device ====================
     bLength            :    0x9 (9 bytes)
     bDescriptorType    :    0x4 Interface
     bInterfaceNumber   :    0x2
     bAlternateSetting  :    0x0
     bNumEndpoints      :    0x1
     bInterfaceClass    :    0x3 Human Interface Device
     bInterfaceSubClass :    0x1
     bInterfaceProtocol :    0x1
     iInterface         :    0x0
      ENDPOINT 0x81: Interrupt IN ==========================
       bLength          :    0x7 (7 bytes)
       bDescriptorType  :    0x5 Endpoint
       bEndpointAddress :   0x81 IN
       bmAttributes     :    0x3 Interrupt
       wMaxPacketSize   :    0x8 (8 bytes)
       bInterval        :   0x40
    INTERFACE 3: Human Interface Device ====================
     bLength            :    0x9 (9 bytes)
     bDescriptorType    :    0x4 Interface
     bInterfaceNumber   :    0x3
     bAlternateSetting  :    0x0
     bNumEndpoints      :    0x1
     bInterfaceClass    :    0x3 Human Interface Device
     bInterfaceSubClass :    0x1
     bInterfaceProtocol :    0x2
     iInterface         :    0x0
      ENDPOINT 0x82: Interrupt IN ==========================
       bLength          :    0x7 (7 bytes)
       bDescriptorType  :    0x5 Endpoint
       bEndpointAddress :   0x82 IN
       bmAttributes     :    0x3 Interrupt
       wMaxPacketSize   :    0x4 (4 bytes)
       bInterval        :   0x40
    INTERFACE 4: Human Interface Device ====================
     bLength            :    0x9 (9 bytes)
     bDescriptorType    :    0x4 Interface
     bInterfaceNumber   :    0x4
     bAlternateSetting  :    0x0
     bNumEndpoints      :    0x2
     bInterfaceClass    :    0x3 Human Interface Device
     bInterfaceSubClass :    0x0
     bInterfaceProtocol :    0x0
     iInterface         :    0x0
      ENDPOINT 0x83: Interrupt IN ==========================
       bLength          :    0x7 (7 bytes)
       bDescriptorType  :    0x5 Endpoint
       bEndpointAddress :   0x83 IN
       bmAttributes     :    0x3 Interrupt
       wMaxPacketSize   :    0x8 (8 bytes)
       bInterval        :   0x20
      ENDPOINT 0x3: Interrupt OUT ==========================
       bLength          :    0x7 (7 bytes)
       bDescriptorType  :    0x5 Endpoint
       bEndpointAddress :    0x3 OUT
       bmAttributes     :    0x3 Interrupt
       wMaxPacketSize   :    0x8 (8 bytes)
       bInterval        :   0x20
    INTERFACE 0: Audio =====================================
     bLength            :    0x9 (9 bytes)
     bDescriptorType    :    0x4 Interface
     bInterfaceNumber   :    0x0
     bAlternateSetting  :    0x0
     bNumEndpoints      :    0x0
     bInterfaceClass    :    0x1 Audio
     bInterfaceSubClass :    0x1
     bInterfaceProtocol :    0x0
     iInterface         :    0x0
    INTERFACE 1: Audio =====================================
     bLength            :    0x9 (9 bytes)
     bDescriptorType    :    0x4 Interface
     bInterfaceNumber   :    0x1
     bAlternateSetting  :    0x0
     bNumEndpoints      :    0x0
     bInterfaceClass    :    0x1 Audio
     bInterfaceSubClass :    0x2
     bInterfaceProtocol :    0x0
     iInterface         :    0x0
    INTERFACE 1, 1: Audio ==================================
     bLength            :    0x9 (9 bytes)
     bDescriptorType    :    0x4 Interface
     bInterfaceNumber   :    0x1
     bAlternateSetting  :    0x1
     bNumEndpoints      :    0x1
     bInterfaceClass    :    0x1 Audio
     bInterfaceSubClass :    0x2
     bInterfaceProtocol :    0x0
     iInterface         :    0x0
      ENDPOINT 0x4: Isochronous OUT ========================
       bLength          :    0x9 (7 bytes)
       bDescriptorType  :    0x5 Endpoint
       bEndpointAddress :    0x4 OUT
       bmAttributes     :    0x1 Isochronous
       wMaxPacketSize   :   0x20 (32 bytes)
       bInterval        :    0x1
DEVICE ID 8087:0aaa on Bus 003 Address 005 =================
 bLength                :   0x12 (18 bytes)
 bDescriptorType        :    0x1 Device
 bcdUSB                 :  0x200 USB 2.0
 bDeviceClass           :   0xe0 Wireless Controller
 bDeviceSubClass        :    0x1
 bDeviceProtocol        :    0x1
 bMaxPacketSize0        :   0x40 (64 bytes)
 idVendor               : 0x8087
 idProduct              : 0x0aaa
 bcdDevice              :    0x2 Device 0.02
 iManufacturer          :    0x0
 iProduct               :    0x0
 iSerialNumber          :    0x0
 bNumConfigurations     :    0x1
  CONFIGURATION 1: 100 mA ==================================
   bLength              :    0x9 (9 bytes)
   bDescriptorType      :    0x2 Configuration
   wTotalLength         :   0xc8 (200 bytes)
   bNumInterfaces       :    0x2
   bConfigurationValue  :    0x1
   iConfiguration       :    0x0
   bmAttributes         :   0xe0 Self Powered, Remote Wakeup
   bMaxPower            :   0x32 (100 mA)
    INTERFACE 0: Wireless Controller =======================
     bLength            :    0x9 (9 bytes)
     bDescriptorType    :    0x4 Interface
     bInterfaceNumber   :    0x0
     bAlternateSetting  :    0x0
     bNumEndpoints      :    0x3
     bInterfaceClass    :   0xe0 Wireless Controller
     bInterfaceSubClass :    0x1
     bInterfaceProtocol :    0x1
     iInterface         :    0x0
      ENDPOINT 0x81: Interrupt IN ==========================
       bLength          :    0x7 (7 bytes)
       bDescriptorType  :    0x5 Endpoint
       bEndpointAddress :   0x81 IN
       bmAttributes     :    0x3 Interrupt
       wMaxPacketSize   :   0x40 (64 bytes)
       bInterval        :    0x1
      ENDPOINT 0x2: Bulk OUT ===============================
       bLength          :    0x7 (7 bytes)
       bDescriptorType  :    0x5 Endpoint
       bEndpointAddress :    0x2 OUT
       bmAttributes     :    0x2 Bulk
       wMaxPacketSize   :   0x40 (64 bytes)
       bInterval        :    0x1
      ENDPOINT 0x82: Bulk IN ===============================
       bLength          :    0x7 (7 bytes)
       bDescriptorType  :    0x5 Endpoint
       bEndpointAddress :   0x82 IN
       bmAttributes     :    0x2 Bulk
       wMaxPacketSize   :   0x40 (64 bytes)
       bInterval        :    0x1
    INTERFACE 1: Wireless Controller =======================
     bLength            :    0x9 (9 bytes)
     bDescriptorType    :    0x4 Interface
     bInterfaceNumber   :    0x1
     bAlternateSetting  :    0x0
     bNumEndpoints      :    0x2
     bInterfaceClass    :   0xe0 Wireless Controller
     bInterfaceSubClass :    0x1
     bInterfaceProtocol :    0x1
     iInterface         :    0x0
      ENDPOINT 0x3: Isochronous OUT ========================
       bLength          :    0x7 (7 bytes)
       bDescriptorType  :    0x5 Endpoint
       bEndpointAddress :    0x3 OUT
       bmAttributes     :    0x1 Isochronous
       wMaxPacketSize   :    0x0 (0 bytes)
       bInterval        :    0x1
      ENDPOINT 0x83: Isochronous IN ========================
       bLength          :    0x7 (7 bytes)
       bDescriptorType  :    0x5 Endpoint
       bEndpointAddress :   0x83 IN
       bmAttributes     :    0x1 Isochronous
       wMaxPacketSize   :    0x0 (0 bytes)
       bInterval        :    0x1
    INTERFACE 1, 1: Wireless Controller ====================
     bLength            :    0x9 (9 bytes)
     bDescriptorType    :    0x4 Interface
     bInterfaceNumber   :    0x1
     bAlternateSetting  :    0x1
     bNumEndpoints      :    0x2
     bInterfaceClass    :   0xe0 Wireless Controller
     bInterfaceSubClass :    0x1
     bInterfaceProtocol :    0x1
     iInterface         :    0x0
      ENDPOINT 0x3: Isochronous OUT ========================
       bLength          :    0x7 (7 bytes)
       bDescriptorType  :    0x5 Endpoint
       bEndpointAddress :    0x3 OUT
       bmAttributes     :    0x1 Isochronous
       wMaxPacketSize   :    0x9 (9 bytes)
       bInterval        :    0x1
      ENDPOINT 0x83: Isochronous IN ========================
       bLength          :    0x7 (7 bytes)
       bDescriptorType  :    0x5 Endpoint
       bEndpointAddress :   0x83 IN
       bmAttributes     :    0x1 Isochronous
       wMaxPacketSize   :    0x9 (9 bytes)
       bInterval        :    0x1
    INTERFACE 1, 2: Wireless Controller ====================
     bLength            :    0x9 (9 bytes)
     bDescriptorType    :    0x4 Interface
     bInterfaceNumber   :    0x1
     bAlternateSetting  :    0x2
     bNumEndpoints      :    0x2
     bInterfaceClass    :   0xe0 Wireless Controller
     bInterfaceSubClass :    0x1
     bInterfaceProtocol :    0x1
     iInterface         :    0x0
      ENDPOINT 0x3: Isochronous OUT ========================
       bLength          :    0x7 (7 bytes)
       bDescriptorType  :    0x5 Endpoint
       bEndpointAddress :    0x3 OUT
       bmAttributes     :    0x1 Isochronous
       wMaxPacketSize   :   0x11 (17 bytes)
       bInterval        :    0x1
      ENDPOINT 0x83: Isochronous IN ========================
       bLength          :    0x7 (7 bytes)
       bDescriptorType  :    0x5 Endpoint
       bEndpointAddress :   0x83 IN
       bmAttributes     :    0x1 Isochronous
       wMaxPacketSize   :   0x11 (17 bytes)
       bInterval        :    0x1
    INTERFACE 1, 3: Wireless Controller ====================
     bLength            :    0x9 (9 bytes)
     bDescriptorType    :    0x4 Interface
     bInterfaceNumber   :    0x1
     bAlternateSetting  :    0x3
     bNumEndpoints      :    0x2
     bInterfaceClass    :   0xe0 Wireless Controller
     bInterfaceSubClass :    0x1
     bInterfaceProtocol :    0x1
     iInterface         :    0x0
      ENDPOINT 0x3: Isochronous OUT ========================
       bLength          :    0x7 (7 bytes)
       bDescriptorType  :    0x5 Endpoint
       bEndpointAddress :    0x3 OUT
       bmAttributes     :    0x1 Isochronous
       wMaxPacketSize   :   0x19 (25 bytes)
       bInterval        :    0x1
      ENDPOINT 0x83: Isochronous IN ========================
       bLength          :    0x7 (7 bytes)
       bDescriptorType  :    0x5 Endpoint
       bEndpointAddress :   0x83 IN
       bmAttributes     :    0x1 Isochronous
       wMaxPacketSize   :   0x19 (25 bytes)
       bInterval        :    0x1
    INTERFACE 1, 4: Wireless Controller ====================
     bLength            :    0x9 (9 bytes)
     bDescriptorType    :    0x4 Interface
     bInterfaceNumber   :    0x1
     bAlternateSetting  :    0x4
     bNumEndpoints      :    0x2
     bInterfaceClass    :   0xe0 Wireless Controller
     bInterfaceSubClass :    0x1
     bInterfaceProtocol :    0x1
     iInterface         :    0x0
      ENDPOINT 0x3: Isochronous OUT ========================
       bLength          :    0x7 (7 bytes)
       bDescriptorType  :    0x5 Endpoint
       bEndpointAddress :    0x3 OUT
       bmAttributes     :    0x1 Isochronous
       wMaxPacketSize   :   0x21 (33 bytes)
       bInterval        :    0x1
      ENDPOINT 0x83: Isochronous IN ========================
       bLength          :    0x7 (7 bytes)
       bDescriptorType  :    0x5 Endpoint
       bEndpointAddress :   0x83 IN
       bmAttributes     :    0x1 Isochronous
       wMaxPacketSize   :   0x21 (33 bytes)
       bInterval        :    0x1
    INTERFACE 1, 5: Wireless Controller ====================
     bLength            :    0x9 (9 bytes)
     bDescriptorType    :    0x4 Interface
     bInterfaceNumber   :    0x1
     bAlternateSetting  :    0x5
     bNumEndpoints      :    0x2
     bInterfaceClass    :   0xe0 Wireless Controller
     bInterfaceSubClass :    0x1
     bInterfaceProtocol :    0x1
     iInterface         :    0x0
      ENDPOINT 0x3: Isochronous OUT ========================
       bLength          :    0x7 (7 bytes)
       bDescriptorType  :    0x5 Endpoint
       bEndpointAddress :    0x3 OUT
       bmAttributes     :    0x1 Isochronous
       wMaxPacketSize   :   0x31 (49 bytes)
       bInterval        :    0x1
      ENDPOINT 0x83: Isochronous IN ========================
       bLength          :    0x7 (7 bytes)
       bDescriptorType  :    0x5 Endpoint
       bEndpointAddress :   0x83 IN
       bmAttributes     :    0x1 Isochronous
       wMaxPacketSize   :   0x31 (49 bytes)
       bInterval        :    0x1
    INTERFACE 1, 6: Wireless Controller ====================
     bLength            :    0x9 (9 bytes)
     bDescriptorType    :    0x4 Interface
     bInterfaceNumber   :    0x1
     bAlternateSetting  :    0x6
     bNumEndpoints      :    0x2
     bInterfaceClass    :   0xe0 Wireless Controller
     bInterfaceSubClass :    0x1
     bInterfaceProtocol :    0x1
     iInterface         :    0x0
      ENDPOINT 0x3: Isochronous OUT ========================
       bLength          :    0x7 (7 bytes)
       bDescriptorType  :    0x5 Endpoint
       bEndpointAddress :    0x3 OUT
       bmAttributes     :    0x1 Isochronous
       wMaxPacketSize   :   0x3f (63 bytes)
       bInterval        :    0x1
      ENDPOINT 0x83: Isochronous IN ========================
       bLength          :    0x7 (7 bytes)
       bDescriptorType  :    0x5 Endpoint
       bEndpointAddress :   0x83 IN
       bmAttributes     :    0x1 Isochronous
       wMaxPacketSize   :   0x3f (63 bytes)
       bInterval        :    0x1
DEVICE ID 25a7:fa23 on Bus 003 Address 002 =================
 bLength                :   0x12 (18 bytes)
 bDescriptorType        :    0x1 Device
 bcdUSB                 :  0x110 USB 1.1
 bDeviceClass           :    0x0 Specified at interface
 bDeviceSubClass        :    0x0
 bDeviceProtocol        :    0x0
 bMaxPacketSize0        :   0x40 (64 bytes)
 idVendor               : 0x25a7
 idProduct              : 0xfa23
 bcdDevice              :  0x241 Device 2.41
 iManufacturer          :    0x1 Error Accessing String
 iProduct               :    0x2 Error Accessing String
 iSerialNumber          :    0x0
 bNumConfigurations     :    0x1
  CONFIGURATION 1: 100 mA ==================================
   bLength              :    0x9 (9 bytes)
   bDescriptorType      :    0x2 Configuration
   wTotalLength         :   0x3b (59 bytes)
   bNumInterfaces       :    0x2
   bConfigurationValue  :    0x1
   iConfiguration       :    0x0
   bmAttributes         :   0xa0 Bus Powered, Remote Wakeup
   bMaxPower            :   0x32 (100 mA)
    INTERFACE 0: Human Interface Device ====================
     bLength            :    0x9 (9 bytes)
     bDescriptorType    :    0x4 Interface
     bInterfaceNumber   :    0x0
     bAlternateSetting  :    0x0
     bNumEndpoints      :    0x1
     bInterfaceClass    :    0x3 Human Interface Device
     bInterfaceSubClass :    0x1
     bInterfaceProtocol :    0x1
     iInterface         :    0x0
      ENDPOINT 0x81: Interrupt IN ==========================
       bLength          :    0x7 (7 bytes)
       bDescriptorType  :    0x5 Endpoint
       bEndpointAddress :   0x81 IN
       bmAttributes     :    0x3 Interrupt
       wMaxPacketSize   :    0x8 (8 bytes)
       bInterval        :    0xa
    INTERFACE 1: Human Interface Device ====================
     bLength            :    0x9 (9 bytes)
     bDescriptorType    :    0x4 Interface
     bInterfaceNumber   :    0x1
     bAlternateSetting  :    0x0
     bNumEndpoints      :    0x1
     bInterfaceClass    :    0x3 Human Interface Device
     bInterfaceSubClass :    0x1
     bInterfaceProtocol :    0x2
     iInterface         :    0x0
      ENDPOINT 0x82: Interrupt IN ==========================
       bLength          :    0x7 (7 bytes)
       bDescriptorType  :    0x5 Endpoint
       bEndpointAddress :   0x82 IN
       bmAttributes     :    0x3 Interrupt
       wMaxPacketSize   :    0x8 (8 bytes)
       bInterval        :    0x2
DEVICE ID 1d6b:0002 on Bus 003 Address 001 =================
 bLength                :   0x12 (18 bytes)
 bDescriptorType        :    0x1 Device
 bcdUSB                 :  0x200 USB 2.0
 bDeviceClass           :    0x9 Hub
 bDeviceSubClass        :    0x0
 bDeviceProtocol        :    0x1
 bMaxPacketSize0        :   0x40 (64 bytes)
 idVendor               : 0x1d6b
 idProduct              : 0x0002
 bcdDevice              :  0x515 Device 5.15
 iManufacturer          :    0x3 Error Accessing String
 iProduct               :    0x2 Error Accessing String
 iSerialNumber          :    0x1 Error Accessing String
 bNumConfigurations     :    0x1
  CONFIGURATION 1: 0 mA ====================================
   bLength              :    0x9 (9 bytes)
   bDescriptorType      :    0x2 Configuration
   wTotalLength         :   0x19 (25 bytes)
   bNumInterfaces       :    0x1
   bConfigurationValue  :    0x1
   iConfiguration       :    0x0
   bmAttributes         :   0xe0 Self Powered, Remote Wakeup
   bMaxPower            :    0x0 (0 mA)
    INTERFACE 0: Hub =======================================
     bLength            :    0x9 (9 bytes)
     bDescriptorType    :    0x4 Interface
     bInterfaceNumber   :    0x0
     bAlternateSetting  :    0x0
     bNumEndpoints      :    0x1
     bInterfaceClass    :    0x9 Hub
     bInterfaceSubClass :    0x0
     bInterfaceProtocol :    0x0
     iInterface         :    0x0
      ENDPOINT 0x81: Interrupt IN ==========================
       bLength          :    0x7 (7 bytes)
       bDescriptorType  :    0x5 Endpoint
       bEndpointAddress :   0x81 IN
       bmAttributes     :    0x3 Interrupt
       wMaxPacketSize   :    0x4 (4 bytes)
       bInterval        :    0xc
DEVICE ID 1d6b:0003 on Bus 002 Address 001 =================
 bLength                :   0x12 (18 bytes)
 bDescriptorType        :    0x1 Device
 bcdUSB                 :  0x310 USB 3.1
 bDeviceClass           :    0x9 Hub
 bDeviceSubClass        :    0x0
 bDeviceProtocol        :    0x3
 bMaxPacketSize0        :    0x9 (9 bytes)
 idVendor               : 0x1d6b
 idProduct              : 0x0003
 bcdDevice              :  0x515 Device 5.15
 iManufacturer          :    0x3 Error Accessing String
 iProduct               :    0x2 Error Accessing String
 iSerialNumber          :    0x1 Error Accessing String
 bNumConfigurations     :    0x1
  CONFIGURATION 1: 0 mA ====================================
   bLength              :    0x9 (9 bytes)
   bDescriptorType      :    0x2 Configuration
   wTotalLength         :   0x1f (31 bytes)
   bNumInterfaces       :    0x1
   bConfigurationValue  :    0x1
   iConfiguration       :    0x0
   bmAttributes         :   0xe0 Self Powered, Remote Wakeup
   bMaxPower            :    0x0 (0 mA)
    INTERFACE 0: Hub =======================================
     bLength            :    0x9 (9 bytes)
     bDescriptorType    :    0x4 Interface
     bInterfaceNumber   :    0x0
     bAlternateSetting  :    0x0
     bNumEndpoints      :    0x1
     bInterfaceClass    :    0x9 Hub
     bInterfaceSubClass :    0x0
     bInterfaceProtocol :    0x0
     iInterface         :    0x0
      ENDPOINT 0x81: Interrupt IN ==========================
       bLength          :    0x7 (7 bytes)
       bDescriptorType  :    0x5 Endpoint
       bEndpointAddress :   0x81 IN
       bmAttributes     :    0x3 Interrupt
       wMaxPacketSize   :    0x4 (4 bytes)
       bInterval        :    0xc
DEVICE ID 1d6b:0002 on Bus 001 Address 001 =================
 bLength                :   0x12 (18 bytes)
 bDescriptorType        :    0x1 Device
 bcdUSB                 :  0x200 USB 2.0
 bDeviceClass           :    0x9 Hub
 bDeviceSubClass        :    0x0
 bDeviceProtocol        :    0x1
 bMaxPacketSize0        :   0x40 (64 bytes)
 idVendor               : 0x1d6b
 idProduct              : 0x0002
 bcdDevice              :  0x515 Device 5.15
 iManufacturer          :    0x3 Error Accessing String
 iProduct               :    0x2 Error Accessing String
 iSerialNumber          :    0x1 Error Accessing String
 bNumConfigurations     :    0x1
  CONFIGURATION 1: 0 mA ====================================
   bLength              :    0x9 (9 bytes)
   bDescriptorType      :    0x2 Configuration
   wTotalLength         :   0x19 (25 bytes)
   bNumInterfaces       :    0x1
   bConfigurationValue  :    0x1
   iConfiguration       :    0x0
   bmAttributes         :   0xe0 Self Powered, Remote Wakeup
   bMaxPower            :    0x0 (0 mA)
    INTERFACE 0: Hub =======================================
     bLength            :    0x9 (9 bytes)
     bDescriptorType    :    0x4 Interface
     bInterfaceNumber   :    0x0
     bAlternateSetting  :    0x0
     bNumEndpoints      :    0x1
     bInterfaceClass    :    0x9 Hub
     bInterfaceSubClass :    0x0
     bInterfaceProtocol :    0x0
     iInterface         :    0x0
      ENDPOINT 0x81: Interrupt IN ==========================
       bLength          :    0x7 (7 bytes)
       bDescriptorType  :    0x5 Endpoint
       bEndpointAddress :   0x81 IN
       bmAttributes     :    0x3 Interrupt
       wMaxPacketSize   :    0x4 (4 bytes)
       bInterval        :    0xc